"...My knees are quivering, my thighs are whimpering, and I've lost all sensation in my foot."	"……我的膝蓋在顫抖，我的大腿在哭泣，我的腳已經失去了知覺。"	"3091462/e 3911124/O Leah/w sunny/t 1130 1400/A leahPaint"
"Just keep perfectly still, Marnie... No squirming!"	"只要保持完全靜止就好，瑪妮……不要動！"	"3091462/e 3911124/O Leah/w sunny/t 1130 1400/A leahPaint"
"Hey, @... what style do you think I should do? I'm up for anything..."	"嘿，@……你覺得我應該畫什麼風格？我什麼都行……"	"3091462/e 3911124/O Leah/w sunny/t 1130 1400/A leahPaint"
"Classic country portrait"	"傳統鄉村肖像"	"3091462/e 3911124/O Leah/w sunny/t 1130 1400/A leahPaint"
"Colorful, retro pop-art"	"多彩的復古流行藝術"	"3091462/e 3911124/O Leah/w sunny/t 1130 1400/A leahPaint"
"Minimalist modern"	"極簡主義現代風"	"3091462/e 3911124/O Leah/w sunny/t 1130 1400/A leahPaint"
"Stick with the classic look, huh? Yeah, I think Marnie will appreciate that."	"保持傳統風格是嗎？好的，我想瑪妮會喜歡的。"	"3091462/e 3911124/O Leah/w sunny/t 1130 1400/A leahPaint"
"Good idea! That sounds fun... Let me get some more yellow paint on the palette..."	"好主意！聽起來很有趣……讓我在調色板上再加一些黃色的顏料……"	"3091462/e 3911124/O Leah/w sunny/t 1130 1400/A leahPaint"
"Hmm... not my usual style, but I'll give it a shot. I'd better switch to acrylic paint for this one..."	"嗯……不是我通常的風格，但我可以試試。我最好換一個丙烯顏料……"	"3091462/e 3911124/O Leah/w sunny/t 1130 1400/A leahPaint"
"How's yours coming along?"	"你的怎麼樣了？"	"3091462/e 3911124/O Leah/w sunny/t 1130 1400/A leahPaint"
"It's a masterpiece of fine art!"	"完全就是傑作！"	"3091462/e 3911124/O Leah/w sunny/t 1130 1400/A leahPaint"
"I'm trying my best..."	"我還在盡力畫……"	"3091462/e 3911124/O Leah/w sunny/t 1130 1400/A leahPaint"
"It looks like chicken scratch"	"看起來像狗爬一樣"	"3091462/e 3911124/O Leah/w sunny/t 1130 1400/A leahPaint"
"Wow, I like your confidence!"	"哇，我喜歡你的自信！"	"3091462/e 3911124/O Leah/w sunny/t 1130 1400/A leahPaint"
"Who knows? Maybe you'll become the next Lupini!"	"誰說得准呢？也許你就是下一個盧皮尼呢！"	"3091462/e 3911124/O Leah/w sunny/t 1130 1400/A leahPaint"
"...Can't wait to see it."	"……我都等不及要看了。"	"3091462/e 3911124/O Leah/w sunny/t 1130 1400/A leahPaint"
"Hey, that's all I ask. If you keep trying your best you can't help but get better at it!"	"嘿，這就是我要的。如果你盡力去做，自然就會越來越擅長！"	"3091462/e 3911124/O Leah/w sunny/t 1130 1400/A leahPaint"
"Hey, that's okay! You gotta start somewhere. And you never know, one person's chicken scratch is another person's 'modern art"	"嘿，沒關係的！萬事起頭難。而且你永遠都說不定，你的狗爬，對另一個人來說可能就是「現代藝術」。"	"3091462/e 3911124/O Leah/w sunny/t 1130 1400/A leahPaint"
"Make me look good!"	"把我畫得漂亮一點！"	"3091462/e 3911124/O Leah/w sunny/t 1130 1400/A leahPaint"
"Shh!"	"噓！"	"3091462/e 3911124/O Leah/w sunny/t 1130 1400/A leahPaint"
"Now, don't forget the techniques I taught you... broad strokes, hold the brush like so..."	"好了，別忘了我教你的技巧……線條要粗，這樣握畫筆……"	"3091462/e 3911124/O Leah/w sunny/t 1130 1400/A leahPaint"
"There!"	"好了！"	"3091462/e 3911124/O Leah/w sunny/t 1130 1400/A leahPaint"
"What do you think?"	"你看看如何？"	"3091462/e 3911124/O Leah/w sunny/t 1130 1400/A leahPaint"
"Oooh!"	"哦哦哦！"	"3091462/e 3911124/O Leah/w sunny/t 1130 1400/A leahPaint"
"I love it! That's going up in my room..."	"我超喜歡！我要把它掛在我的房間裡……"	"3091462/e 3911124/O Leah/w sunny/t 1130 1400/A leahPaint"
"Now, let's see what you've got, @."	"好了，讓我們看看你的怎麼樣，@。"	"3091462/e 3911124/O Leah/w sunny/t 1130 1400/A leahPaint"
"Erm... It's... interesting!"	"呃……這……很有趣！"	"3091462/e 3911124/O Leah/w sunny/t 1130 1400/A leahPaint"
"It's, uh... a different kind of approach, for sure..."	"肯定是用了，呃……一種不同的方法……"	"3091462/e 3911124/O Leah/w sunny/t 1130 1400/A leahPaint"
"Let me see"	"讓我看看"	"3091462/e 3911124/O Leah/w sunny/t 1130 1400/A leahPaint"
"Marnie, you can hang both of these in your room!"	"瑪妮，你可以把兩幅都掛在你的房間！"	"3091462/e 3911124/O Leah/w sunny/t 1130 1400/A leahPaint"
"Em... @, why don't you go ahead and keep yours? It might be nice to, uh... own your first-ever painting... ya know?"	"呃……@，要不你把自己的畫留下來吧？把自己的第一幅畫收藏起來，呃……很棒的……是吧？"	"3091462/e 3911124/O Leah/w sunny/t 1130 1400/A leahPaint"
"Um... Honey? Where were you planning to hang that painting you did?"	"嗯……親愛的？你原本打算把你畫的那幅畫掛在哪？"	"3091462/e 3911124/O Leah/w sunny/t 1130 1400/A leahPaint"
